搜北京夜晚的图,search pic
搜一下北京晚上的壁纸,search pic
找下北京晚上的壁纸,search pic
想给手机壁纸换一张北京夜晚的图,search pic
想给电脑换一张北京夜晚的壁纸,search pic
找五张晚上北京的图片,search pic
找一下蔷薇的图片,search pic
找一张汽车壁纸,search pic
有没有夏天的壁纸,search pic
能不能找一下冬天的壁纸,search pic
找一下北邮的图片,search pic
搜一下傍晚的图片,search pic
给我搜星空壁纸,search pic
百度一下傍晚天空图片,search pic
能帮我找一下太阳系图片吗,search pic
能帮我搜索日本樱花壁纸吗,search pic
帮我找一下北京夜晚的壁纸吧,search pic
能在百度帮我搜索北京秋天的壁纸吗,search pic
帮我搜一下北京冬天的图片吧,search pic
我想搜索北京夏天的图片,search pic
可以帮我搜一下北京夜晚的图片吗,search pic
在百度搜一下北京夜景图片,search pic
搜索北邮的图片,search pic
搜一张北京的壁纸,search pic
能搜索下九张北京夜晚的图片吗,search pic
帮我在百度搜一下北邮夜晚的图片,search pic
能帮我找十张北邮的图片吗,search pic
我想要你在百度上搜五张北邮的图片,search pic
帮个忙，在百度找三张北邮校门口的图片,search pic
我想要三张北京夜晚的图片当壁纸,search pic
